Domande,Risposte
QUALE è IL MIGLIORE CANE DA GUARDIA?,DIPENDE DA COSA STAI CERCANDO
MIGLIORE CANE PER PROTEGGRE CASA MIA ,"IL CANE CORSO, IL ROTWEILLER E ALTRI"
CONSIGLIAMI UN CANE DA GUARDIA BRAVO CON I BAMBINI,il pastore tedesco
un cane da guardia facile da addestrare,il belgian malinois
una classifica dei cani da guardia ,"cane corso e mastino napoletano, dogue de bordeaux, fila brasileiro, mastiff e bullmastiff, tibetan mastiff, schnauzer medio e alcune razze praticamente sconosciute in Italia, come il broholmer, il ca de bou (perro dogo maillorquin), il cane dell’atlas, il rafeiro do alentejo."
cani da guardia pericolosi,tutti
cane da guardia da tenere in casa,cane corso 
cane da guardia semplice da gestire,non ci sono semplici da gestire
cane da guardia grosse dimensioni,pastore del caucaso